{
  "actor": {
    "agent_id": "canon",
    "role": "reviewer"
  },
  "at": "2026-08-01T18:07:15.730735Z",
  "change_id": "s43-findings-are-records",
  "disposition": "fixed",
  "file_ref": ".canon/ledger/kind=finding",
  "introduced_by": "c8c67469f7cb2ffd5eaed16a4499f28feaaee286",
  "kind": "finding",
  "resolution_sha": "e3c0860172352d284bb28bc6220edf8e7bad71e5",
  "reviewed_sha": "c8c67469f7cb2ffd5eaed16a4499f28feaaee286",
  "reviewer": "R3Honest",
  "round": 3,
  "schema": 1,
  "seq": 6,
  "severity": "blocker",
  "summary": "Round 2 findings 9 and 11 record fea1bc8b as resolution_sha, but neither correction lands there - both first enter git in c8c67469"
}